Job Title,Job Ratings,Pros,Cons
Software engineer (swe ii),5.0,"May 5, 2025","Current employee, more than 5 years","Current employee, more than 5 years","Talented Colleagues: You're surrounded by incredibly smart, driven, and passionate people from diverse backgrounds. The opportunity to collaborate with and learn from experts is a huge plus.
Impact & Innovation: Working on projects that often have global reach and significant impact. Being part of a company at the forefront of technology is exciting and rewarding.
Resources & Learning: Access to extensive internal resources, training programs, and opportunities for continuous learning and development are top-notch.
Compensation & Benefits: Generally competitive salary packages, comprehensive health benefits, perks, and other employee benefits are attractive.
Culture (Team Specific): Many teams foster a collaborative and open environment, encouraging idea sharing and teamwork. Being part of the vibrant tech community in Taipei is also a positive.","Work-Life Balance (Can Vary): While the company talks about work-life balance, the demanding nature of the work and fast pace can sometimes lead to long hours or difficulty fully disconnecting, depending heavily on the specific team and role.
Bureaucracy & Scale: As a massive global organization, navigating internal processes, getting approvals, or initiating changes can sometimes be slow or feel bureaucratic.
Integration Challenges: Working with global teams across different time zones can sometimes present communication or scheduling challenges.
Role Specificity: Your experience can vary significantly based on your specific team, manager, and project area. Not all teams operate identically."
S s e(senior software engineer),4.0,"Aug 4, 2025","Current employee, more than 1 year","Current employee, more than 1 year","- Cool tech
- Big Community","- Politics
- Massive Codebase"
Software engineer,5.0,"Aug 3, 2025",Current employee,Current employee,You get to work with smart people and state-of-the-art infrastructure.,Company is very big and at times is slowed down by bureaucracy.
Software engineer,5.0,"Aug 4, 2014","Current employee, more than 5 years","Current employee, more than 5 years","Amazing work culture, cutting edge work, flexibility and independence, awesome food",Your growth in the company directly depends on the efforts you put in and results you produce. So always need to be on your toes and continue to work towards challenging goals.
Senior software engineer,4.0,"Aug 1, 2025","Current employee, more than 1 year","Current employee, more than 1 year","Supportive team, good work-life balance, exposure to cutting-edge networking technologies like SRv6 and DPDK","Sometimes priorities shift quickly due to customer escalations, which can disrupt planning."
Recruiter,5.0,"Aug 3, 2025",Former employee,Former employee,Flexibility to work high pay,Limited growth in recruiting and development
Data analyst,5.0,"Aug 2, 2025","Current employee, less than 1 year","Current employee, less than 1 year",It was good with all being supportive,Nothing as such. there might be some minor cons
